Area,Region,Year,Area_code,Number, Prevalence1 ,Prevalence
NHS South Gloucestershire CCG,South West England,2016,E38000155,17134,0.076,7.6
NHS South Kent Coast CCG,South East England,2016,E38000156,16232,0.095,9.5
NHS South Lincolnshire CCG,East Midlands,2016,E38000157,10753,0.089,8.9
NHS South Manchester CCG,North West England,2016,E38000158,9755,0.073,7.3
NHS South Norfolk CCG,East of England,2016,E38000159,18229,0.091,9.1
NHS South Reading CCG,South East England,2016,E38000160,6186,0.069,6.9
NHS South Sefton CCG,North West England,2016,E38000161,11990,0.092,9.2
NHS South Tees CCG,North East England,2016,E38000162,19968,0.09,9
NHS South Tyneside CCG,North East England,2016,E38000163,11383,0.092,9.2
NHS South Warwickshire CCG,West Midlands,2016,E38000164,18183,0.083,8.3
NHS South West Lincolnshire CCG,East Midlands,2016,E38000165,9034,0.087,8.7
NHS South Worcestershire CCG,West Midlands,2016,E38000166,22117,0.089,8.9
NHS Southampton CCG,South East England,2016,E38000167,14588,0.071,7.1
NHS Southend CCG,East of England,2016,E38000168,12809,0.088,8.8
NHS Southern Derbyshire CCG,East Midlands,2016,E38000169,37375,0.087,8.7
NHS Southport and Formby CCG,North West England,2016,E38000170,9410,0.098,9.8
NHS Southwark CCG,London,2016,E38000171,22577,0.088,8.8
NHS St Helens CCG,North West England,2016,E38000172,13162,0.09,9
NHS Stafford and Surrounds CCG,West Midlands,2016,E38000173,10902,0.085,8.5
NHS Stockport CCG,North West England,2016,E38000174,20280,0.087,8.7
NHS Stoke on Trent CCG,West Midlands,2016,E38000175,18580,0.089,8.9
NHS Sunderland CCG,North East England,2016,E38000176,20123,0.088,8.8
NHS Surrey Downs CCG,South East England,2016,E38000177,18522,0.079,7.9
NHS Surrey Heath CCG,South East England,2016,E38000178,5994,0.077,7.7
NHS Sutton CCG,London,2016,E38000179,12763,0.079,7.9
NHS Swale CCG,South East England,2016,E38000180,7778,0.086,8.6
NHS Swindon CCG,South West England,2016,E38000181,13725,0.076,7.6
NHS Tameside and Glossop CCG,North West England,2016,E38000182,18474,0.09,9
NHS Telford and Wrekin CCG,West Midlands,2016,E38000183,11460,0.084,8.4
NHS Thanet CCG,South East England,2016,E38000184,11137,0.097,9.7
NHS Thurrock CCG,East of England,2016,E38000185,10306,0.079,7.9
NHS Tower Hamlets CCG,London,2016,E38000186,20052,0.083,8.3
NHS Trafford CCG,North West England,2016,E38000187,15525,0.083,8.3
NHS Vale of York CCG,Yorkshire and the Humber,2016,E38000188,22438,0.075,7.5
NHS Vale Royal CCG,North West England,2016,E38000189,7073,0.085,8.5
NHS Wakefield CCG,Yorkshire and the Humber,2016,E38000190,24029,0.088,8.8
NHS Walsall CCG,West Midlands,2016,E38000191,22103,0.101,10.1
NHS Waltham Forest CCG,London,2016,E38000192,21954,0.102,10.2
NHS Wandsworth CCG,London,2016,E38000193,18620,0.071,7.1
NHS Warrington CCG,North West England,2016,E38000194,13431,0.079,7.9
NHS Warwickshire North CCG,West Midlands,2016,E38000195,13803,0.089,8.9
NHS West Cheshire CCG,North West England,2016,E38000196,16156,0.084,8.4
NHS West Essex CCG,East of England,2016,E38000197,20191,0.083,8.3
NHS West Hampshire CCG,South East England,2016,E38000198,38356,0.084,8.4
NHS West Kent CCG,South East England,2016,E38000199,30198,0.078,7.8
NHS West Lancashire CCG,North West England,2016,E38000200,7930,0.086,8.6
NHS West Leicestershire CCG,East Midlands,2016,E38000201,25828,0.081,8.1
NHS West London CCG,London,2016,E38000202,16025,0.085,8.5
NHS West Norfolk CCG,East of England,2016,E38000203,14751,0.101,10.1
NHS West Suffolk CCG,East of England,2016,E38000204,16054,0.086,8.6
NHS Wigan Borough CCG,North West England,2016,E38000205,22147,0.084,8.4
NHS Wiltshire CCG,South West England,2016,E38000206,32864,0.083,8.3
"NHS Windsor, Ascot and Maidenhead CCG",South East England,2016,E38000207,8913,0.077,7.7
NHS Wirral CCG,North West England,2016,E38000208,23662,0.09,9
NHS Wokingham CCG,South East England,2016,E38000209,9388,0.073,7.3
NHS Wolverhampton CCG,West Midlands,2016,E38000210,22610,0.111,11.1
NHS Wyre Forest CCG,West Midlands,2016,E38000211,7796,0.095,9.5
"NHS Airedale, Wharfedale and Craven CCG",Yorkshire and the Humber,2017,E38000001,12329,0.095,9.5
NHS Ashford CCG,South East England,2017,E38000002,8612,0.085,8.5
NHS Aylesbury Vale CCG,South East England,2017,E38000003,13091,0.078,7.8
NHS Barking and Dagenham CCG,London,2017,E38000004,14084,0.092,9.2
NHS Barnet CCG,London,2017,E38000005,26978,0.087,8.7
NHS Barnsley CCG,Yorkshire and the Humber,2017,E38000006,17730,0.09,9
NHS Basildon and Brentwood CCG,East of England,2017,E38000007,17552,0.083,8.3
NHS Bassetlaw CCG,Yorkshire and the Humber,2017,E38000008,8690,0.092,9.2
NHS Bath and North East Somerset CCG,South West England,2017,E38000009,11478,0.075,7.5
NHS Bedfordshire CCG,East of England,2017,E38000010,29874,0.082,8.2
NHS Bexley CCG,London,2017,E38000011,16237,0.083,8.3
NHS Birmingham CrossCity CCG,West Midlands,2017,E38000012,57612,0.099,9.9
NHS Birmingham South and Central CCG,West Midlands,2017,E38000013,16105,0.1,10
NHS Blackburn with Darwen CCG,North West England,2017,E38000014,11231,0.1,10
NHS Blackpool CCG,North West England,2017,E38000015,11119,0.097,9.7
NHS Bolton CCG,North West England,2017,E38000016,20927,0.093,9.3
NHS Bracknell and Ascot CCG,South East England,2017,E38000017,7764,0.07,7
NHS Bradford City CCG,Yorkshire and the Humber,2017,E38000018,6742,0.111,11.1
NHS Bradford Districts CCG,Yorkshire and the Humber,2017,E38000019,26649,0.102,10.2
NHS Brent CCG,London,2017,E38000020,30895,0.116,11.6
NHS Brighton and Hove CCG,South East England,2017,E38000021,16793,0.069,6.9
NHS Bristol CCG,South West England,2017,E38000022,27089,0.073,7.3
NHS Bromley CCG,London,2017,E38000023,22024,0.083,8.3
NHS Bury CCG,North West England,2017,E38000024,13308,0.088,8.8
NHS Calderdale CCG,Yorkshire and the Humber,2017,E38000025,15501,0.091,9.1
NHS Cambridgeshire and Peterborough CCG,East of England,2017,E38000026,57178,0.079,7.9
NHS Camden CCG,London,2017,E38000027,16409,0.078,7.8
NHS Cannock Chase CCG,West Midlands,2017,E38000028,9450,0.085,8.5
NHS Canterbury and Coastal CCG,South East England,2017,E38000029,14526,0.083,8.3
NHS Castle Point and Rochford CCG,East of England,2017,E38000030,12854,0.088,8.8
NHS Central London (Westminster) CCG,London,2017,E38000031,12357,0.081,8.1
NHS Central Manchester CCG,North West England,2017,E38000032,12065,0.08,8
NHS Chiltern CCG,South East England,2017,E38000033,22194,0.085,8.5
NHS Chorley and South Ribble CCG,North West England,2017,E38000034,11728,0.083,8.3
NHS City and Hackney CCG,London,2017,E38000035,20943,0.091,9.1
NHS Coastal West Sussex CCG,South East England,2017,E38000036,39385,0.095,9.5
NHS Corby CCG,East Midlands,2017,E38000037,4211,0.078,7.8
NHS Coventry and Rugby CCG,West Midlands,2017,E38000038,31505,0.086,8.6
NHS Crawley CCG,South East England,2017,E38000039,7004,0.079,7.9
NHS Croydon CCG,London,2017,E38000040,32199,0.106,10.6
NHS Cumbria CCG,North West England,2017,E38000041,39882,0.095,9.5
NHS Darlington CCG,North East England,2017,E38000042,7461,0.088,8.8
"NHS Dartford, Gravesham and Swanley CCG",South East England,2017,E38000043,17898,0.085,8.5
NHS Doncaster CCG,Yorkshire and the Humber,2017,E38000044,22261,0.09,9
NHS Dorset CCG,South West England,2017,E38000045,59002,0.091,9.1
NHS Dudley CCG,West Midlands,2017,E38000046,24166,0.094,9.4
"NHS Durham Dales, Easington and Sedgefield CCG",North East England,2017,E38000047,21459,0.094,9.4
NHS Ealing CCG,London,2017,E38000048,30151,0.109,10.9
NHS East and North Hertfordshire CCG,East of England,2017,E38000049,35657,0.078,7.8
NHS East Lancashire CCG,North West England,2017,E38000050,28556,0.095,9.5
NHS East Leicestershire and Rutland CCG,East Midlands,2017,E38000051,23776,0.088,8.8
NHS East Riding of Yorkshire CCG,Yorkshire and the Humber,2017,E38000052,24572,0.092,9.2
NHS East Staffordshire CCG,West Midlands,2017,E38000053,8881,0.087,8.7
NHS East Surrey CCG,South East England,2017,E38000054,11491,0.077,7.7
"NHS Eastbourne, Hailsham and Seaford CCG",South East England,2017,E38000055,15725,0.099,9.9
NHS Eastern Cheshire CCG,North West England,2017,E38000056,14509,0.088,8.8
NHS Enfield CCG,London,2017,E38000057,25057,0.096,9.6
NHS Erewash CCG,East Midlands,2017,E38000058,6795,0.085,8.5
NHS Fareham and Gosport CCG,South East England,2017,E38000059,13732,0.083,8.3
NHS Fylde & Wyre CCG,North West England,2017,E38000060,13876,0.098,9.8
NHS Gloucestershire CCG,South West England,2017,E38000062,43735,0.085,8.5
NHS Great Yarmouth and Waveney CCG,East of England,2017,E38000063,18053,0.101,10.1
NHS Greater Huddersfield CCG,Yorkshire and the Humber,2017,E38000064,18091,0.091,9.1
NHS Greater Preston CCG,North West England,2017,E38000065,14151,0.086,8.6
NHS Greenwich CCG,London,2017,E38000066,18344,0.083,8.3
NHS Guildford and Waverley CCG,South East England,2017,E38000067,12574,0.072,7.2
NHS Halton CCG,North West England,2017,E38000068,8793,0.086,8.6
"NHS Hambleton, Richmondshire and Whitby CCG",Yorkshire and the Humber,2017,E38000069,11456,0.09,9
NHS Hammersmith and Fulham CCG,London,2017,E38000070,11697,0.077,7.7
NHS Hardwick CCG,East Midlands,2017,E38000071,8411,0.092,9.2
NHS Haringey CCG,London,2017,E38000072,20664,0.092,9.2
NHS Harrogate and Rural District CCG,Yorkshire and the Humber,2017,E38000073,10960,0.085,8.5
NHS Harrow CCG,London,2017,E38000074,22145,0.11,11
NHS Hartlepool and Stockton-On-Tees CCG,North East England,2017,E38000075,19753,0.085,8.5
NHS Hastings and Rother CCG,South East England,2017,E38000076,15773,0.102,10.2
NHS Havering CCG,London,2017,E38000077,17669,0.086,8.6
NHS Herefordshire CCG,West Midlands,2017,E38000078,15094,0.095,9.5
NHS Herts Valleys CCG,East of England,2017,E38000079,37722,0.08,8
"NHS Heywood, Middleton and Rochdale CCG",North West England,2017,E38000080,16457,0.097,9.7
NHS High Weald Lewes Havens CCG,South East England,2017,E38000081,12514,0.087,8.7
NHS Hillingdon CCG,London,2017,E38000082,21350,0.088,8.8
NHS Horsham and Mid Sussex CCG,South East England,2017,E38000083,14624,0.078,7.8
NHS Hounslow CCG,London,2017,E38000084,21373,0.097,9.7
NHS Hull CCG,Yorkshire and the Humber,2017,E38000085,16701,0.08,8
NHS Ipswich and East Suffolk CCG,East of England,2017,E38000086,30033,0.091,9.1
NHS Isle of Wight CCG,South East England,2017,E38000087,12262,0.104,10.4
NHS Islington CCG,London,2017,E38000088,14566,0.073,7.3
NHS Kernow CCG,South West England,2017,E38000089,46032,0.099,9.9
NHS Kingston CCG,London,2017,E38000090,9646,0.067,6.7
NHS Knowsley CCG,North West England,2017,E38000091,10662,0.09,9
NHS Lambeth CCG,London,2017,E38000092,24539,0.09,9
NHS Lancashire North CCG,North West England,2017,E38000093,11296,0.083,8.3
NHS Leeds North CCG,Yorkshire and the Humber,2017,E38000094,14958,0.091,9.1
NHS Leeds South and East CCG,Yorkshire and the Humber,2017,E38000095,16280,0.082,8.2
NHS Leeds West CCG,Yorkshire and the Humber,2017,E38000096,19163,0.071,7.1
NHS Leicester City CCG,East Midlands,2017,E38000097,30091,0.11,11
NHS Lewisham CCG,London,2017,E38000098,23272,0.096,9.6
NHS Lincolnshire East CCG,East Midlands,2017,E38000099,20510,0.104,10.4
NHS Lincolnshire West CCG,East Midlands,2017,E38000100,16177,0.083,8.3
NHS Liverpool CCG,North West England,2017,E38000101,31493,0.079,7.9
NHS Luton CCG,East of England,2017,E38000102,17364,0.103,10.3
NHS Mansfield and Ashfield CCG,East Midlands,2017,E38000103,14382,0.089,8.9
NHS Medway CCG,South East England,2017,E38000104,18121,0.08,8
NHS Merton CCG,London,2017,E38000105,13745,0.082,8.2
NHS Mid Essex CCG,East of England,2017,E38000106,26452,0.083,8.3
NHS Milton Keynes CCG,South East England,2017,E38000107,16530,0.078,7.8
NHS Nene CCG,East of England,2017,E38000108,43717,0.084,8.4
NHS Newark & Sherwood CCG,East Midlands,2017,E38000109,8859,0.09,9
NHS Newbury and District CCG,South East England,2017,E38000110,6571,0.077,7.7
NHS Newcastle Gateshead CCG,North East England,2017,E38000212,31989,0.078,7.8
NHS Newham CCG,London,2017,E38000113,28431,0.106,10.6
NHS North & West Reading CCG,South East England,2017,E38000114,6465,0.08,8
NHS North Derbyshire CCG,East Midlands,2017,E38000115,20672,0.09,9
NHS North Durham CCG,North East England,2017,E38000116,17058,0.083,8.3
NHS North East Essex CCG,East of England,2017,E38000117,24600,0.091,9.1
NHS North East Hampshire and Farnham CCG,South East England,2017,E38000118,12369,0.073,7.3
NHS North East Lincolnshire CCG,Yorkshire and the Humber,2017,E38000119,11558,0.089,8.9
NHS North Hampshire CCG,South East England,2017,E38000120,13655,0.076,7.6
NHS North Kirklees CCG,Yorkshire and the Humber,2017,E38000121,14967,0.099,9.9
NHS North Lincolnshire CCG,Yorkshire and the Humber,2017,E38000122,12416,0.089,8.9
NHS North Manchester CCG,North West England,2017,E38000123,10703,0.075,7.5
NHS North Norfolk CCG,East of England,2017,E38000124,15316,0.105,10.5
NHS North Somerset CCG,South West England,2017,E38000125,15412,0.088,8.8
NHS North Staffordshire CCG,West Midlands,2017,E38000126,15642,0.086,8.6
NHS North Tyneside CCG,North East England,2017,E38000127,14406,0.085,8.5
NHS North West Surrey CCG,South East England,2017,E38000128,22008,0.079,7.9
"NHS North, East, West Devon CCG",South West England,2017,E38000129,66454,0.089,8.9
NHS Northumberland CCG,North East England,2017,E38000130,24981,0.094,9.4
NHS Norwich CCG,East of England,2017,E38000131,13051,0.078,7.8
NHS Nottingham City CCG,East Midlands,2017,E38000132,20271,0.078,7.8
NHS Nottingham North and East CCG,East Midlands,2017,E38000133,10619,0.086,8.6
NHS Nottingham West CCG,East Midlands,2017,E38000134,7882,0.084,8.4
NHS Oldham CCG,North West England,2017,E38000135,17072,0.095,9.5
NHS Oxfordshire CCG,South East England,2017,E38000136,40895,0.075,7.5
NHS Portsmouth CCG,South East England,2017,E38000137,12591,0.073,7.3
NHS Redbridge CCG,London,2017,E38000138,25812,0.108,10.8
NHS Redditch and Bromsgrove CCG,West Midlands,2017,E38000139,12740,0.086,8.6
NHS Richmond CCG,London,2017,E38000140,11406,0.071,7.1
NHS Rotherham CCG,Yorkshire and the Humber,2017,E38000141,19349,0.091,9.1
NHS Rushcliffe CCG,East Midlands,2017,E38000142,7533,0.079,7.9
NHS Salford CCG,North West England,2017,E38000143,15688,0.078,7.8
NHS Sandwell and West Birmingham CCG,West Midlands,2017,E38000144,44216,0.115,11.5
NHS Scarborough and Ryedale CCG,Yorkshire and the Humber,2017,E38000145,9228,0.1,10
NHS Sheffield CCG,Yorkshire and the Humber,2017,E38000146,38439,0.082,8.2
NHS Shropshire CCG,West Midlands,2017,E38000147,24324,0.093,9.3
NHS Slough CCG,South East England,2017,E38000148,11485,0.103,10.3
NHS Solihull CCG,West Midlands,2017,E38000149,15583,0.091,9.1
NHS Somerset CCG,South West England,2017,E38000150,42526,0.094,9.4
NHS South Cheshire CCG,North West England,2017,E38000151,12551,0.085,8.5
NHS South Devon and Torbay CCG,South West England,2017,E38000152,23956,0.102,10.2
NHS South East Staffordshire and Seisdon Peninsula CCG,West Midlands,2017,E38000153,16231,0.087,8.7
NHS South Eastern Hampshire CCG,South East England,2017,E38000154,15398,0.088,8.8
NHS South Gloucestershire CCG,South West England,2017,E38000155,17358,0.076,7.6
NHS South Kent Coast CCG,South East England,2017,E38000156,16476,0.096,9.6
NHS South Lincolnshire CCG,East Midlands,2017,E38000157,10932,0.089,8.9
NHS South Manchester CCG,North West England,2017,E38000158,9865,0.073,7.3
NHS South Norfolk CCG,East of England,2017,E38000159,18522,0.091,9.1
NHS South Reading CCG,South East England,2017,E38000160,6254,0.07,7
NHS South Sefton CCG,North West England,2017,E38000161,12088,0.093,9.3
NHS South Tees CCG,North East England,2017,E38000162,20098,0.09,9
NHS South Tyneside CCG,North East England,2017,E38000163,11472,0.093,9.3
NHS South Warwickshire CCG,West Midlands,2017,E38000164,18550,0.085,8.5
NHS South West Lincolnshire CCG,East Midlands,2017,E38000165,9214,0.089,8.9
NHS South Worcestershire CCG,West Midlands,2017,E38000166,22392,0.09,9
NHS Southampton CCG,South East England,2017,E38000167,14763,0.072,7.2
NHS Southend CCG,East of England,2017,E38000168,12939,0.088,8.8
NHS Southern Derbyshire CCG,East Midlands,2017,E38000169,37887,0.088,8.8
NHS Southport and Formby CCG,North West England,2017,E38000170,9480,0.099,9.9
NHS Southwark CCG,London,2017,E38000171,23046,0.088,8.8
NHS St Helens CCG,North West England,2017,E38000172,13329,0.091,9.1
NHS Stafford and Surrounds CCG,West Midlands,2017,E38000173,11029,0.086,8.6
NHS Stockport CCG,North West England,2017,E38000174,20535,0.087,8.7
NHS Stoke on Trent CCG,West Midlands,2017,E38000175,18729,0.089,8.9
NHS Sunderland CCG,North East England,2017,E38000176,20285,0.088,8.8
NHS Surrey Downs CCG,South East England,2017,E38000177,18823,0.08,8
NHS Surrey Heath CCG,South East England,2017,E38000178,6090,0.078,7.8
NHS Sutton CCG,London,2017,E38000179,12929,0.079,7.9
NHS Swale CCG,South East England,2017,E38000180,7938,0.087,8.7
NHS Swindon CCG,South West England,2017,E38000181,14029,0.078,7.8
NHS Tameside and Glossop CCG,North West England,2017,E38000182,18673,0.091,9.1
NHS Telford and Wrekin CCG,West Midlands,2017,E38000183,11665,0.085,8.5
NHS Thanet CCG,South East England,2017,E38000184,11353,0.098,9.8
NHS Thurrock CCG,East of England,2017,E38000185,10504,0.08,8
NHS Tower Hamlets CCG,London,2017,E38000186,20725,0.083,8.3
NHS Trafford CCG,North West England,2017,E38000187,15715,0.083,8.3
NHS Vale of York CCG,Yorkshire and the Humber,2017,E38000188,22756,0.076,7.6
NHS Vale Royal CCG,North West England,2017,E38000189,7181,0.086,8.6
NHS Wakefield CCG,Yorkshire and the Humber,2017,E38000190,24339,0.089,8.9
NHS Walsall CCG,West Midlands,2017,E38000191,22392,0.102,10.2
NHS Waltham Forest CCG,London,2017,E38000192,22412,0.103,10.3
NHS Wandsworth CCG,London,2017,E38000193,18916,0.071,7.1
NHS Warrington CCG,North West England,2017,E38000194,13710,0.08,8
NHS Warwickshire North CCG,West Midlands,2017,E38000195,14057,0.091,9.1
NHS West Cheshire CCG,North West England,2017,E38000196,16368,0.085,8.5
NHS West Essex CCG,East of England,2017,E38000197,20552,0.084,8.4
NHS West Hampshire CCG,South East England,2017,E38000198,38954,0.084,8.4
NHS West Kent CCG,South East England,2017,E38000199,30677,0.079,7.9
NHS West Lancashire CCG,North West England,2017,E38000200,8040,0.086,8.6
NHS West Leicestershire CCG,East Midlands,2017,E38000201,26254,0.081,8.1
NHS West London CCG,London,2017,E38000202,16337,0.086,8.6
NHS West Norfolk CCG,East of England,2017,E38000203,14941,0.102,10.2
NHS West Suffolk CCG,East of England,2017,E38000204,16331,0.087,8.7
NHS Wigan Borough CCG,North West England,2017,E38000205,22482,0.085,8.5
NHS Wiltshire CCG,South West England,2017,E38000206,33510,0.084,8.4
"NHS Windsor, Ascot and Maidenhead CCG",South East England,2017,E38000207,9052,0.078,7.8
NHS Wirral CCG,North West England,2017,E38000208,23867,0.091,9.1
NHS Wokingham CCG,South East England,2017,E38000209,9594,0.074,7.4
NHS Wolverhampton CCG,West Midlands,2017,E38000210,22715,0.111,11.1
NHS Wyre Forest CCG,West Midlands,2017,E38000211,7975,0.097,9.7
"NHS Airedale, Wharfedale and Craven CCG",Yorkshire and the Humber,2018,E38000001,12476,0.095,9.5
NHS Ashford CCG,South East England,2018,E38000002,8803,0.085,8.5
NHS Aylesbury Vale CCG,South East England,2018,E38000003,13373,0.078,7.8
NHS Barking and Dagenham CCG,London,2018,E38000004,14411,0.092,9.2
NHS Barnet CCG,London,2018,E38000005,27521,0.087,8.7
NHS Barnsley CCG,Yorkshire and the Humber,2018,E38000006,18014,0.091,9.1
NHS Basildon and Brentwood CCG,East of England,2018,E38000007,17785,0.084,8.4
NHS Bassetlaw CCG,Yorkshire and the Humber,2018,E38000008,8829,0.093,9.3
NHS Bath and North East Somerset CCG,South West England,2018,E38000009,11569,0.075,7.5
NHS Bedfordshire CCG,East of England,2018,E38000010,30467,0.083,8.3
NHS Bexley CCG,London,2018,E38000011,16443,0.083,8.3
NHS Birmingham CrossCity CCG,West Midlands,2018,E38000012,58247,0.1,10
NHS Birmingham South and Central CCG,West Midlands,2018,E38000013,16244,0.1,10
NHS Blackburn with Darwen CCG,North West England,2018,E38000014,11248,0.1,10
NHS Blackpool CCG,North West England,2018,E38000015,11185,0.098,9.8
NHS Bolton CCG,North West England,2018,E38000016,21138,0.094,9.4
NHS Bracknell and Ascot CCG,South East England,2018,E38000017,7860,0.071,7.1
NHS Bradford City CCG,Yorkshire and the Humber,2018,E38000018,6811,0.112,11.2
NHS Bradford Districts CCG,Yorkshire and the Humber,2018,E38000019,26991,0.102,10.2
NHS Brent CCG,London,2018,E38000020,31553,0.118,11.8
NHS Brighton and Hove CCG,South East England,2018,E38000021,17062,0.07,7
NHS Bristol CCG,South West England,2018,E38000022,27332,0.073,7.3
NHS Bromley CCG,London,2018,E38000023,22263,0.083,8.3
NHS Bury CCG,North West England,2018,E38000024,13473,0.089,8.9
NHS Calderdale CCG,Yorkshire and the Humber,2018,E38000025,15705,0.092,9.2
NHS Cambridgeshire and Peterborough CCG,East of England,2018,E38000026,58156,0.08,8
NHS Camden CCG,London,2018,E38000027,16839,0.079,7.9
NHS Cannock Chase CCG,West Midlands,2018,E38000028,9626,0.086,8.6
NHS Canterbury and Coastal CCG,South East England,2018,E38000029,14742,0.083,8.3
NHS Castle Point and Rochford CCG,East of England,2018,E38000030,13055,0.089,8.9
NHS Central London (Westminster) CCG,London,2018,E38000031,12596,0.082,8.2
NHS Central Manchester CCG,North West England,2018,E38000032,12278,0.08,8
NHS Chiltern CCG,South East England,2018,E38000033,22535,0.086,8.6
NHS Chorley and South Ribble CCG,North West England,2018,E38000034,11975,0.084,8.4
NHS City and Hackney CCG,London,2018,E38000035,21451,0.092,9.2
NHS Coastal West Sussex CCG,South East England,2018,E38000036,40022,0.096,9.6
NHS Corby CCG,East Midlands,2018,E38000037,4309,0.079,7.9
NHS Coventry and Rugby CCG,West Midlands,2018,E38000038,31999,0.086,8.6
NHS Crawley CCG,South East England,2018,E38000039,7145,0.079,7.9
NHS Croydon CCG,London,2018,E38000040,32747,0.107,10.7
NHS Cumbria CCG,North West England,2018,E38000041,40306,0.096,9.6
NHS Darlington CCG,North East England,2018,E38000042,7590,0.089,8.9
"NHS Dartford, Gravesham and Swanley CCG",South East England,2018,E38000043,18200,0.086,8.6
NHS Doncaster CCG,Yorkshire and the Humber,2018,E38000044,22457,0.091,9.1
NHS Dorset CCG,South West England,2018,E38000045,59824,0.092,9.2
NHS Dudley CCG,West Midlands,2018,E38000046,24401,0.095,9.5
"NHS Durham Dales, Easington and Sedgefield CCG",North East England,2018,E38000047,21668,0.095,9.5
NHS Ealing CCG,London,2018,E38000048,30709,0.11,11
NHS East and North Hertfordshire CCG,East of England,2018,E38000049,36244,0.079,7.9
NHS East Lancashire CCG,North West England,2018,E38000050,28763,0.096,9.6
NHS East Leicestershire and Rutland CCG,East Midlands,2018,E38000051,24101,0.089,8.9
NHS East Riding of Yorkshire CCG,Yorkshire and the Humber,2018,E38000052,24955,0.093,9.3
NHS East Staffordshire CCG,West Midlands,2018,E38000053,9095,0.088,8.8
NHS East Surrey CCG,South East England,2018,E38000054,11712,0.078,7.8
"NHS Eastbourne, Hailsham and Seaford CCG",South East England,2018,E38000055,15976,0.1,10
NHS Eastern Cheshire CCG,North West England,2018,E38000056,14780,0.089,8.9
NHS Enfield CCG,London,2018,E38000057,25470,0.096,9.6
NHS Erewash CCG,East Midlands,2018,E38000058,6853,0.086,8.6
NHS Fareham and Gosport CCG,South East England,2018,E38000059,13985,0.084,8.4
NHS Fylde & Wyre CCG,North West England,2018,E38000060,14031,0.099,9.9
NHS Gloucestershire CCG,South West England,2018,E38000062,44423,0.086,8.6
NHS Great Yarmouth and Waveney CCG,East of England,2018,E38000063,18266,0.102,10.2
NHS Greater Huddersfield CCG,Yorkshire and the Humber,2018,E38000064,18341,0.091,9.1
NHS Greater Preston CCG,North West England,2018,E38000065,14395,0.087,8.7
NHS Greenwich CCG,London,2018,E38000066,18722,0.084,8.4
NHS Guildford and Waverley CCG,South East England,2018,E38000067,12744,0.072,7.2
NHS Halton CCG,North West England,2018,E38000068,8883,0.087,8.7
"NHS Hambleton, Richmondshire and Whitby CCG",Yorkshire and the Humber,2018,E38000069,11602,0.091,9.1
NHS Hammersmith and Fulham CCG,London,2018,E38000070,11927,0.078,7.8
NHS Hardwick CCG,East Midlands,2018,E38000071,8563,0.093,9.3
NHS Haringey CCG,London,2018,E38000072,21141,0.093,9.3
NHS Harrogate and Rural District CCG,Yorkshire and the Humber,2018,E38000073,11127,0.086,8.6
NHS Harrow CCG,London,2018,E38000074,22560,0.111,11.1
NHS Hartlepool and Stockton-On-Tees CCG,North East England,2018,E38000075,20014,0.085,8.5
NHS Hastings and Rother CCG,South East England,2018,E38000076,15989,0.103,10.3
NHS Havering CCG,London,2018,E38000077,17832,0.087,8.7
NHS Herefordshire CCG,West Midlands,2018,E38000078,15342,0.096,9.6
NHS Herts Valleys CCG,East of England,2018,E38000079,38365,0.08,8
"NHS Heywood, Middleton and Rochdale CCG",North West England,2018,E38000080,16656,0.098,9.8
NHS High Weald Lewes Havens CCG,South East England,2018,E38000081,12709,0.088,8.8
NHS Hillingdon CCG,London,2018,E38000082,21739,0.088,8.8
NHS Horsham and Mid Sussex CCG,South East England,2018,E38000083,14880,0.078,7.8
NHS Hounslow CCG,London,2018,E38000084,21858,0.098,9.8
NHS Hull CCG,Yorkshire and the Humber,2018,E38000085,16887,0.081,8.1
NHS Ipswich and East Suffolk CCG,East of England,2018,E38000086,30467,0.092,9.2
NHS Isle of Wight CCG,South East England,2018,E38000087,12490,0.105,10.5
NHS Islington CCG,London,2018,E38000088,14889,0.074,7.4
NHS Kernow CCG,South West England,2018,E38000089,46710,0.1,10
NHS Kingston CCG,London,2018,E38000090,9859,0.067,6.7
NHS Knowsley CCG,North West England,2018,E38000091,10733,0.091,9.1
NHS Lambeth CCG,London,2018,E38000092,25014,0.09,9
NHS Lancashire North CCG,North West England,2018,E38000093,11355,0.084,8.4
NHS Leeds North CCG,Yorkshire and the Humber,2018,E38000094,15067,0.091,9.1
NHS Leeds South and East CCG,Yorkshire and the Humber,2018,E38000095,16376,0.083,8.3
NHS Leeds West CCG,Yorkshire and the Humber,2018,E38000096,19404,0.071,7.1
NHS Leicester City CCG,East Midlands,2018,E38000097,30529,0.11,11
NHS Lewisham CCG,London,2018,E38000098,23728,0.097,9.7
NHS Lincolnshire East CCG,East Midlands,2018,E38000099,20707,0.105,10.5
NHS Lincolnshire West CCG,East Midlands,2018,E38000100,16504,0.084,8.4
NHS Liverpool CCG,North West England,2018,E38000101,31700,0.079,7.9
NHS Luton CCG,East of England,2018,E38000102,17635,0.103,10.3
